{
  "artifacts": {
    "architecture_evidence": ".github/task-runs/2026-08-07-rv64-v15w-arch9-ca37-a1/evidence/architecture-current-ca37-v2.json",
    "architecture_result": ".github/task-runs/2026-08-07-rv64-v15w-arch9-ca37-a1/evidence/architecture-current-verification-v2.json",
    "cohort_inventory": ".github/task-runs/2026-08-07-rv64-v15w-ca37-current-reconciliation-a1/evidence/arch-stable-candidate-ca37-v1/cohort-inventory.json",
    "debt_ledger": "npc/rv64/design/arch/architecture-debt-ledger.json",
    "functional_aggregate": ".github/task-runs/2026-08-07-rv64-v15w-ca37-l01-refresh-a1/evidence/functional/functional-aggregate.json",
    "holder_census": "npc/rv64/design/arch/producer-holder-census.json",
    "system_recertification": "npc/rv64/eval/ppa/evidence/system-recertification-current.json"
  },
  "claim": {
    "architecture_feasible_seed": null,
    "architecture_freeze": "ARCH_STABLE",
    "canonical": null,
    "ppa": "UNQUALIFIED",
    "promotion_eligible": false
  },
  "design_id": "sha256:ca37187e08a3ed489a20d8e05942a2fe8b33ae85904d2edb43e1df08332f9b6f",
  "freeze_inputs": {
    "binaries": [
      {
        "kind": "simulator_binary",
        "path": ".github/task-runs/2026-08-07-rv64-v15w-ca37-l01-refresh-a1/evidence/functional/frozen/NpcSimTop",
        "sha256": "328aa42ccb5d3506f0b409d35759c3437dac01bf46d0f1793bba4b416bd6b8df"
      },
      {
        "kind": "reference_model_binary",
        "path": ".github/task-runs/2026-08-07-rv64-v15w-ca37-l01-refresh-a1/evidence/functional/frozen/riscv64-nemu-interpreter-so",
        "sha256": "d2446ca548a49b74468e65c7c41121adef282db31efe371d2b6d0ce8d25158a9"
      }
    ],
    "config": [
      {
        "kind": "kconfig",
        "path": ".github/task-runs/2026-08-07-rv64-v15w-ca37-l01-refresh-a1/evidence/functional/frozen/npc.config",
        "sha256": "63ecfda4b377430c468116a77efb77345705c3fcf9aca499b641b287cc6da5ce"
      },
      {
        "kind": "kconfig",
        "path": "npc/rv64/.config",
        "sha256": "63ecfda4b377430c468116a77efb77345705c3fcf9aca499b641b287cc6da5ce"
      }
    ],
    "constraints": [
      {
        "kind": "primary_sdc",
        "path": ".github/task-runs/2026-08-07-rv64-v15w-ca37-current-reconciliation-a1/evidence/arch-stable-candidate-ca37-v1/primary-clock-5ns.sdc",
        "sha256": "0942f4cc004ac87aa80122024406f17047f8e809b5fa87eee2114c47a1a420ae"
      }
    ],
    "filelists": [
      {
        "kind": "test_inventory",
        "path": "npc/rv64/testbench/Makefile",
        "sha256": "22fa19ff1b24312550cd31c347f1da513c2d5f8b793ccb4af5bf0a4121dac96e"
      },
      {
        "kind": "rtl_filelist",
        "path": "npc/rv64/vsrc/filelist.mk",
        "sha256": "6529498bf0538122f5f22034e11166cec014306ac0e67966ccd512bf04f4067b"
      }
    ],
    "generated_headers": [
      {
        "kind": "generated_header",
        "path": "npc/rv64/include/config/auto.conf",
        "sha256": "ed0f2ab770451d3ae640978407f6e2eef1e39ff9dc93a0d3e4f88dabf4b59df4"
      },
      {
        "kind": "generated_header",
        "path": "npc/rv64/include/config/auto.conf.cmd",
        "sha256": "cf0a40805dd3125fe96ce04c8c0cdacaa3367cd06c034d4d5658038f0dcd60b6"
      },
      {
        "kind": "generated_header",
        "path": "npc/rv64/include/config/cc.h",
        "sha256": "e3b0c44298fc1c149afbf4c8996fb92427ae41e4649b934ca495991b7852b855"
      },
      {
        "kind": "generated_header",
        "path": "npc/rv64/include/config/cc/gpp.h",
        "sha256": "e3b0c44298fc1c149afbf4c8996fb92427ae41e4649b934ca495991b7852b855"
      },
      {
        "kind": "generated_header",
        "path": "npc/rv64/include/config/cc/o3.h",
        "sha256": "e3b0c44298fc1c149afbf4c8996fb92427ae41e4649b934ca495991b7852b855"
      },
      {
        "kind": "generated_header",
        "path": "npc/rv64/include/config/cc/opt.h",
        "sha256": "e3b0c44298fc1c149afbf4c8996fb92427ae41e4649b934ca495991b7852b855"
      },
      {
        "kind": "generated_header",
        "path": "npc/rv64/include/config/npc/basic/stats.h",
        "sha256": "e3b0c44298fc1c149afbf4c8996fb92427ae41e4649b934ca495991b7852b855"
      },
      {
        "kind": "generated_header",
        "path": "npc/rv64/include/config/npc/batch/mode.h",
        "sha256": "e3b0c44298fc1c149afbf4c8996fb92427ae41e4649b934ca495991b7852b855"
      },
      {
        "kind": "generated_header",
        "path": "npc/rv64/include/config/npc/branch/stats.h",
        "sha256": "e3b0c44298fc1c149afbf4c8996fb92427ae41e4649b934ca495991b7852b855"
      },
      {
        "kind": "generated_header",
        "path": "npc/rv64/include/config/npc/cache/stats.h",
        "sha256": "e3b0c44298fc1c149afbf4c8996fb92427ae41e4649b934ca495991b7852b855"
      },
      {
        "kind": "generated_header",
        "path": "npc/rv64/include/config/npc/colored/log.h",
        "sha256": "e3b0c44298fc1c149afbf4c8996fb92427ae41e4649b934ca495991b7852b855"
      },
      {
        "kind": "generated_header",
        "path": "npc/rv64/include/config/npc/debug/ports.h",
        "sha256": "e3b0c44298fc1c149afbf4c8996fb92427ae41e4649b934ca495991b7852b855"
      },
      {
        "kind": "generated_header",
        "path": "npc/rv64/include/config/npc/debug/ring.h",
        "sha256": "e3b0c44298fc1c149afbf4c8996fb92427ae41e4649b934ca495991b7852b855"
      },
      {
        "kind": "generated_header",
        "path": "npc/rv64/include/config/npc/default/log/path.h",
        "sha256": "e3b0c44298fc1c149afbf4c8996fb92427ae41e4649b934ca495991b7852b855"
      },
      {
        "kind": "generated_header",
        "path": "npc/rv64/include/config/npc/default/max/cycles.h",
        "sha256": "e3b0c44298fc1c149afbf4c8996fb92427ae41e4649b934ca495991b7852b855"
      },
      {
        "kind": "generated_header",
        "path": "npc/rv64/include/config/npc/default/ooo/window/cycles.h",
        "sha256": "e3b0c44298fc1c149afbf4c8996fb92427ae41e4649b934ca495991b7852b855"
      },
      {
        "kind": "generated_header",
        "path": "npc/rv64/include/config/npc/default/progress/interval.h",
        "sha256": "e3b0c44298fc1c149afbf4c8996fb92427ae41e4649b934ca495991b7852b855"
      },
      {
        "kind": "generated_header",
        "path": "npc/rv64/include/config/npc/difftest.h",
        "sha256": "e3b0c44298fc1c149afbf4c8996fb92427ae41e4649b934ca495991b7852b855"
      },
      {
        "kind": "generated_header",
        "path": "npc/rv64/include/config/npc/dtrace.h",
        "sha256": "e3b0c44298fc1c149afbf4c8996fb92427ae41e4649b934ca495991b7852b855"
      },
      {
        "kind": "generated_header",
        "path": "npc/rv64/include/config/npc/dtrace/by/default.h",
        "sha256": "e3b0c44298fc1c149afbf4c8996fb92427ae41e4649b934ca495991b7852b855"
      },
      {
        "kind": "generated_header",
        "path": "npc/rv64/include/config/npc/expr.h",
        "sha256": "e3b0c44298fc1c149afbf4c8996fb92427ae41e4649b934ca495991b7852b855"
      },
      {
        "kind": "generated_header",
        "path": "npc/rv64/include/config/npc/has/vga.h",
        "sha256": "e3b0c44298fc1c149afbf4c8996fb92427ae41e4649b934ca495991b7852b855"
      },
      {
        "kind": "generated_header",
        "path": "npc/rv64/include/config/npc/itrace.h",
        "sha256": "e3b0c44298fc1c149afbf4c8996fb92427ae41e4649b934ca495991b7852b855"
      },
      {
        "kind": "generated_header",
        "path": "npc/rv64/include/config/npc/itrace/by/default.h",
        "sha256": "e3b0c44298fc1c149afbf4c8996fb92427ae41e4649b934ca495991b7852b855"
      },
      {
        "kind": "generated_header",
        "path": "npc/rv64/include/config/npc/itrace/cond.h",
        "sha256": "e3b0c44298fc1c149afbf4c8996fb92427ae41e4649b934ca495991b7852b855"
      },
      {
        "kind": "generated_header",
        "path": "npc/rv64/include/config/npc/log/file.h",
        "sha256": "e3b0c44298fc1c149afbf4c8996fb92427ae41e4649b934ca495991b7852b855"
      },
      {
        "kind": "generated_header",
        "path": "npc/rv64/include/config/npc/mtrace.h",
        "sha256": "e3b0c44298fc1c149afbf4c8996fb92427ae41e4649b934ca495991b7852b855"
      },
      {
        "kind": "generated_header",
        "path": "npc/rv64/include/config/npc/mtrace/by/default.h",
        "sha256": "e3b0c44298fc1c149afbf4c8996fb92427ae41e4649b934ca495991b7852b855"
      },
      {
        "kind": "generated_header",
        "path": "npc/rv64/include/config/npc/ooo/stats.h",
        "sha256": "e3b0c44298fc1c149afbf4c8996fb92427ae41e4649b934ca495991b7852b855"
      },
      {
        "kind": "generated_header",
        "path": "npc/rv64/include/config/npc/ooo/window/by/default.h",
        "sha256": "e3b0c44298fc1c149afbf4c8996fb92427ae41e4649b934ca495991b7852b855"
      },
      {
        "kind": "generated_header",
        "path": "npc/rv64/include/config/npc/perf/mode.h",
        "sha256": "e3b0c44298fc1c149afbf4c8996fb92427ae41e4649b934ca495991b7852b855"
      },
      {
        "kind": "generated_header",
        "path": "npc/rv64/include/config/npc/progress/by/default.h",
        "sha256": "e3b0c44298fc1c149afbf4c8996fb92427ae41e4649b934ca495991b7852b855"
      },
      {
        "kind": "generated_header",
        "path": "npc/rv64/include/config/npc/sdb.h",
        "sha256": "e3b0c44298fc1c149afbf4c8996fb92427ae41e4649b934ca495991b7852b855"
      },
      {
        "kind": "generated_header",
        "path": "npc/rv64/include/config/npc/sim/stats.h",
        "sha256": "e3b0c44298fc1c149afbf4c8996fb92427ae41e4649b934ca495991b7852b855"
      },
      {
        "kind": "generated_header",
        "path": "npc/rv64/include/config/npc/stdin/keyboard.h",
        "sha256": "e3b0c44298fc1c149afbf4c8996fb92427ae41e4649b934ca495991b7852b855"
      },
      {
        "kind": "generated_header",
        "path": "npc/rv64/include/config/npc/summary/stats.h",
        "sha256": "e3b0c44298fc1c149afbf4c8996fb92427ae41e4649b934ca495991b7852b855"
      },
      {